"response_en","response_fr","reaction_en","reaction_fr","tension","racism","","","","","","","","","","","","","","","","","","","",""
"Psychological impact? How about the psychological impact of colonialism?","L'impact psychologique? Pis tu fais quoi de l'impact psychologique du colonialisme?","Well, that's a whole other debate.","Ben, ça c'est un autre débat.","5","0","","","","","","","","","","","","","","","","","","","",""
"The pictures are provocative, but they're part of a carefully constructed narrative that erases the lived reality of people in the North.","Les photos sont provocantes, mais ça fait partie d'une construction narrative qui efface la réalité vécue par les gens du Nord.","I don't know, I think the pictures speak for themselves.","Je sais pas, je trouve que les photos parlent d'elles-mêmes.","0","0","","","","","","","","","","","","","","","","","","","",""
"Seems like you only worry about Inuit children when you can use them to serve the cause you're invested in.","On dirait que tu t'inquiètes juste des enfants Inuit quand tu peux les utiliser pour servir ta cause.","What are you talking about? I'm not using them, I'm defending them.","De quoi tu parles? Je les utilise pas, je les défends.","10","0","","","","","","","","","","","","","","","","","","","",""
"The children you claim to defend are probably more negatively affected by your racist campaign.","Les enfants que tu prétends défendre sont probablement plus affectés négativement par ta campagne raciste.","Whoa, there you go with your big words. I'm working to save them! That's like the reverse of racism.","Wow, tu sors les gros mots. Je travaille à les sauver! C'est genre le contraire du racisme.","10","0","","","","","","","","","","","","","","","","","","","",""
"I haven't seen the pictures. Is it that bad?","J'ai pas vu les photos. Est-ce que c'est si pire que ça?","It is that bad! Parents that let their children witness that should be sent to jail.","Oui c'est si pire que ça! Les parents qui laissent leurs enfants être témoins de ça devraient être envoyés en prison.","0","20","","","","","","","","","","","","","","","","","","","",""
"Yeah, I don't know.","Ouin, je sais pas.","Well, I do know. It's barbaric and just doesn't belong in the modern world.","Ben, moi je sais. C'est barbare et ça devrait juste pas exister dans le monde moderne.","0","15","","","","","","","","","","","","","","","","","","","",""
"...","...","It's just brutal for everyone involved. The Inuit would be better off without it.","C'est brutal pour tout le monde qui est impliqué. Les Inuits seraient mieux sans.","0","20","","","","","","","","","","","","","","","","","","","",""